107,LIETUVA DIDŽ[IOJO] KARO METU,"sunkūs be galo laikai
lietuvą brangią suspaudė
žūsta vergijoj vaikai
daugel jų priešas iššaudė
sodžių šimtai pelenuos 
vėjo nešiojami sauso
žmonės tuščia aimanuos
niekas negirdi neklauso
kur didžiavyriai tautos
veltui jie mums besapnavos
nėra jų gal kitados
bočių tėvai jais didžiavos
daug išbėgiojo kai kas
rusijoje skursta iš bado
mes gi sau laužom rankas
likę našlaičiais be vado"
108,NEVĖŽIS PER KARĄ,"juodo nevėžio vilnys sukilo
tamsios banguoja rūsčiai
štai nuo dubysos trenksmas prabilo
griaudamas eina plačiai
bėkit į kalną pasižvalgyti
kas ten smarkiai vakaruos
beldžia žaibuoja apmaudo vytį
pragaras neša nasruos
žalgirio smarkūs eina atbudę
nuožmūs kryžiuočių pulkai
mūsų prabočius amžiais bežudę
kraujo prigėrę vilkai
žudė kryžiuočiai švedai naikino
plėšė prancūzų laikai
bet nei prabočiai to nepažino
ko susilaukė vaikai
eina germanai nuo magdeburgo
eina nuo reino vagos
nuo regensburgo mainco augsburgo
plaukia banga už bangos
kaizeris veda viešpats berlyno
kerštui teutonus visus
ko neišplėšė tai sunaikino
kaip audražygis baisus
juodo nevėžio bangos nutilo
tiek dar nematė velnių
ir nusiminus upė pagilo 
ašaras neša žmonių
laikas ir tuosius karo galiūnus
kaip perėjūnus nušluos
vien tik ištvėrę lietuvos sūnūs
augs ir tvirtės veikaluos"
109,NEPRIKLAUSOMYBĘ ATGAVUS,"nejaugi tai ne sapnas ne svajonė
viliojusi dar vakar be vilties
nejau vergijoj slėgusi dejonė
dabar tik sapnas šmėkla praeities
jauna laisva pati savęs valdovė
tautų eilėn įstojo lietuva
savu krauju vergijos nusiplovė
sutraukius pančius ištverme sava
lyg būtų grįžęs amžius gedimino
ir pilkalnių sukilę milžinai
europos vėlei viešpačiai sužino
lietuvių vardą skambantį šaunai
už ką už ką dievuliau ta malonė
jog leidai mums sulaukti tos dienos
o kiek kitų į amžiną kelionę
nuėjo skurdūs laukdami anos
už juos karščiau tėvynę gal mylėjom
ar jai aukų gal nešėm brangesnių
o ne o ne tiktai daugiau kentėjom
per didūs nešti jungą kalinių
likimą aukštą viešpatie mums skyrei
pirmiesiems džiaugtis laisvės spinduliais
garbė jums budrūs šių dienų didvyriai
laisvais išvedę šalį vieškeliais
garbė garbė kad iš maskvos griuvėsių
drąsiais pečiais ją išnešėt kilniai
nors jūsų aš vardų nebeminėsiu
bet jus minės su pagarba ainiai"
110,ŽELIGOVSKIUI VILNIŲ PAGROBUS,"pavojuj motinatėvynė
ateina audra iš pietų 
tai lenkas išgama tautų
mums neša pančius ir žudynę
dvarų ieškodams prarastų
dar vakar svetimoj vergijoj
prieš caro klaupės dievukus 
prancūzo nūn globoj puikus
mums švaisto gautu kalaviju
ir mūsų degina laukus
gana po priedanga brolystės
mums čiulpė syvus pašalais
kultūros savo skarmalais
mums plėšė kalbą dėl lenkystės
ir smaugė savo verpalais
dabar šalin numetęs kaukę
ginkluotus siunčia plėšikus
ir taško mums kraujais laukus
o po europą visgi šaukia
kad tai ne jų būrys smarkus
gana lietuviškos kantrybės
ginkluota kelkis lietuva
dienelė laukia nelengva
bet gelbės dangiškos galybės
ir paskutinė bus kova
petys į petį už tėvynę
nuo palangos lig varėnos
sulaukę puotos kruvinos
kaip mūsų proseniai ją gynė
taip ginsme sūnūs šios dienos"
111,DAINŲ ŠVENTEI,"dainų dainelės aidų aidais
skambiai plačiai tvirtai galingai
per kalnų kalnus miškais laukais
lengvai rimtai ir sutartingai
į vieną giją susipynę
aplėkit lietuvątėvynę
skambiai plačiai galingai
tautos dainele tu išlikai
viena kad žuvo didžiavyriai
kai slėgė sunkūs vargų laikai
tu irgi daug oi daug prityrei
bet pas kaimietį ištvermingą 
tu išlikai sveika galinga
kad žuvo didžiavyriai
tautos dainele tu gaivinai
per ilgus amžius mūsų sielą
viena budėjai kai milžinai
kapuos sapnavo šalį mielą
budėjai supdama lopšelį
jaunuolį guodei ir senelį
tautos auklėjai sielą"
